"search_link_amazon","amazon_product_url","title","overlay_text","description","niche","french_hint","image_description_for_llm"
"https://www.amazon.fr/s?k=narrow+console+table+hallway+entryway+slim","","A Console Table That Elevates Your Entire Entryway","Style Your Entry","The foundation of any great entryway. This slim console provides a surface for decor and hidden storage, all in a stunning design.
👇 Shop this look → [LIEN_AFFILIATE]
#consoletable #entrywaydecor #hallwaydecor #homedecor #interiordesign","entryway_decor","Table console étroite","Photorealistic vertical Pinterest image 1000x1500, a sleek, narrow console table in a light oak finish. It sits against a deep blue accent wall in an entryway. On top, a minimalist sculptural vase and a small stack of coffee table books are styled perfectly. The golden hour light creates a warm, inviting glow. The scene is curated and aspirational. 8K photorealistic, professional interior photography style."
"https://www.amazon.fr/s?k=bathroom+drawer+divider+insert+organizers","","Keep Your Drawer From Becoming A Junk Drawer","Drawer Bliss Inside","Open your bathroom drawer to perfection. These customizable dividers create a home for every hair tie, cotton pad, and product, eliminating the daily hunt.
💡 Organize it → [LIEN_AFFILIATE]
#drawerorganization #bathroomorganization #organization #homedecor #lifehacks","bathroom_storage","Organisateur tiroir salle de bain","Photorealistic vertical Pinterest image 1000x1500, a top-down view of an open, light wood bathroom drawer. Clear, modular acrylic dividers are configured to neatly separate cotton swabs in a glass jar, hair ties, skincare samples, and other small items. The organization is impeccable and satisfying, lit by soft, even light."
"https://www.amazon.fr/s?k=ceramic+catchall+tray+entryway+bowl","","Never Lose Your Keys Again With This Simple Tray","A Place For Everything","The simplest hack for an organized entry. This beautiful tray corrals keys, wallets, and sunglasses so you can always find them.
🛒 Grab it here → [LIEN_AFFILIATE]
#entrywayorganization #catchalltray #homedecor #organization #minimalist","entryway_decor","Plateau rangement clés","Photorealistic vertical Pinterest image 1000x1500, an extreme close-up of a handmade glazed ceramic catchall tray in a muted terracotta color. It sits on a light wood console table. Inside are a set of modern keys and a pair of sunglasses, artfully arranged. Soft, natural light from a nearby window makes the texture of the glaze pop. 8K photorealistic, professional interior photography style."
"https://www.amazon.fr/s?k=wall+mount+clamp+storage+rack+organizer","","The Clamp Rack That Saves Your Sanity & Space","Clamp Clutter Gone","Stop tripping over loose clamps! This wall-mounted rack organizes every size neatly and securely, freeing up floor space and making them easy to grab.
🔧 Organize here → [LIEN_AFFILIATE]
#woodworking #workshoporganization #toolstorage #diyworkspace #bricolage","desk_organization","Range-serres mural","Photorealistic vertical Pinterest image 1000x1500, a sturdy wall-mounted clamp rack holding an assortment of bar clamps and C-clamps of various sizes. The rack is mounted on a clean, shiplap wall in a bright workshop. The clamps are arranged neatly, creating orderly lines and shadows. The overall feel is one of a professional, well-maintained, and efficient workspace."
"https://www.amazon.fr/s?k=mirror+medicine+cabinet+with+storage","","A Medicine Cabinet You'll Actually Want To Open","Hidden Storage Win","Why choose between a mirror and storage? This sleek cabinet does both beautifully, keeping your essentials out of sight but always within reach.
💊 Find it here → [LIEN_AFFILIATE]
#medicinecabinet #bathroommirror #bathroomrenovation #hiddenstorage #modernbathroom","bathroom_storage","Armoire à pharmacie miroir","Photorealistic vertical Pinterest image 1000x1500, a close-up of a modern, frameless mirrored medicine cabinet mounted on a light grey wall. The door is slightly ajar, revealing a perfectly organized interior with small shelves holding minimalist bottles and jars. The reflection shows a tidy bathroom vanity with a single sink, enhancing the sense of space and order."
"https://www.amazon.fr/s?k=self+leveling+cross+line+laser+level","","Laser Level That Makes Every Project Perfectly Straight","Straight Lines. Always.","Achieve professional-level precision on every DIY project. This self-leveling laser projects crisp lines for perfect shelves, pictures, and tile work effortlessly.
⚡ Get precise → [LIEN_AFFILIATE]
#diytools #homeimprovement #laserlevel #renovation #bricolage","desk_organization","Niveau laser autonivelant","Photorealistic vertical Pinterest image 1000x1500, a modern red laser level projecting a bright green cross-line onto a clean, light grey wall. The tool sits on a small tripod on a wooden floor, surrounded by a few other high-quality tools. The scene is crisp and professional, with a shallow depth of field focusing on the laser line, conveying accuracy and ease."
"https://www.amazon.fr/s?k=runner+rug+hallway+entryway+washable","","Create a Cozy Vibe Instantly With an Entryway Rug","Soft Landing","The fastest way to add warmth and texture. This durable runner rug defines your space and feels amazing underfoot.
✨ Find your rug → [LIEN_AFFILIATE]
#entrywayrug #runnerrug #homedecor #cozyhome #interiordesign","entryway_decor","Tapis couloir lavable","Photorealistic vertical Pinterest image 1000x1500, a beautiful beige and ivory washable runner rug lining a bright entryway hallway. It leads to a door with light streaming in. The rug has a subtle textured pattern. It sits on a light wood floor. The scene feels warm, welcoming, and incredibly cozy. 8K photorealistic, professional interior photography style."
"https://www.amazon.fr/s?k=seagrass+rope+basket+bathroom+storage","","The Simple Basket That Solves Bathroom Clutter","Clutter? Contained.","The easiest way to add style and storage. This beautiful woven basket corrals extra toilet paper, towels, or toys, making your bathroom instantly tidier.
🧺 Grab this basket → [LIEN_AFFILIATE]
#basketdecor #bathroomstorage #homedecor #organization #naturaldecor","bathroom_storage","Panier rangement nature","Photorealistic vertical Pinterest image 1000x1500, a cozy corner of a bathroom next to a freestanding tub. A large, beautifully crafted seagrass basket sits on the floor, overflowing with three neatly rolled plush white towels. A single pothos plant trails down beside it. The scene is bathed in warm, soft light, creating a serene and natural aesthetic."
"https://www.amazon.fr/s?k=modern+wall+hooks+coat+rack+brass","","The Hooks That Turn a Blank Wall Into a Storage Spot","Walls That Work","Maximize your vertical space with style. These elegant hooks are perfect for coats, bags, and hats, keeping them off the floor.
👇 Get the hooks → [LIEN_AFFILIATE]
#wallhooks #entrywaydecor #coatrack #homeorganization #smallspace","entryway_decor","Porte-manteaux mural","Photorealistic vertical Pinterest image 1000x1500, a set of three minimalist brass wall hooks mounted on a pale grey wall. A stylish beige trench coat and a leather tote bag are hanging from them. The composition is simple, elegant, and highly functional. Soft morning light creates a gentle highlight on the metal. 8K photorealistic, professional interior photography style."
