"search_link_amazon","amazon_product_url","slug","title","overlay_text","description","niche","keywords""https://www.amazon.fr/s?k=10+Cozy+Bedroom+Decor+Ideas+That+Will+Transform+Your+Space""","Unnamed: 8","10 Cozy Bedroom Decor Ideas That Will Transform Your Space","Transform Your Bedroom Instantly!","Discover these 10 simple yet stunning bedroom decor ideas to create a cozy and inviting retreat. Perfect for any budget and style. Get inspired and start your transformation today! [LIEN_AFFILIATE]","bedroom decor","bedroom decor, cozy bedroom, home decor, bedroom ideas, interior design, bedroom inspiration, DIY decor, affordable decor"
"https://www.amazon.fr/s?k=soft+throw+blanket+decorative","https://www.amazon.fr/Wajade-Couverture-d%C3%A9corative-Duveteuse-white-178cmx203cm/dp/B0DJ4F66XJ/ref=sr_1_1_sspa?dib=eyJ2IjoiMSJ9.eSKWRPsQ7iNyTtuNjxG64XHj4CjCSOMs531znvWfXl-Anm8ONIEPaYJygAbQn3xIX7m0nGFopVfIvQr1ugGBaiMhZ1CBNwYqQ_SHRSsK6YjpVEuNhCD_HXTjY86R5cqVTFNXO9vy6TUl6dMKJOd_4C06bV5FBg9cXUYolXyVV8CtkOdRUUQW_29soXZMn9Wou8UHrRrJqV8B6pOqe9NJwWMSoPalarryS8q2ew6b-q-GeNC1RUPnSP-64JmEQ_Ma_WEQ_y9ftFpIBLZRnsPqUxeCN5z0cStBxSJ_auLLE1c.3I4dE34WZ8id1yYwHn8O81vWzXx5gld-gCVFvZXu08s&dib_tag=se&keywords=soft+throw+blanket+decorative&qid=1772067896&sr=8-1-spons&aref=FoEsT2WwyV&sp_csd=d2lkZ2V0TmFtZT1zcF9hdGY&psc=1","10 Cozy Bedroom Decor Ideas That Will Transform Your Space","Transform Your Bedroom Into A Cozy Sanctuary","Discover simple yet stunning bedroom decor ideas that create a cozy and inviting atmosphere. From plush textiles to warm lighting, these tips will help you design the perfect retreat for relaxation. Perfect for small spaces and rental-friendly upgrades! [LIEN_AFFILIATE]","bedroom decor","bedroom decor, cozy bedroom, home decor, interior design, bedroom ideas, small bedroom, rental decor, DIY bedroom","","","","","","",""
"https://www.amazon.fr/s?k=minimalist+wall+art+set","https://www.amazon.fr/HMDKHI-D%C3%A9coration-abstraite-botaniques-minimalistes/dp/B0CSD8Y8R8/ref=sr_1_1_sspa?dib=eyJ2IjoiMSJ9.kYRVivweSKiU3St66JryH8TZ1g9UD7ViKbc-X5cZsrrYLmRrItWQ9H8pj5MinZoSyx3sq-Pynezh9x4zHrOiqC278Ef1r5gZsVWyZvy0mY1pEi_WlxL2kHuV3H5fIqBT4sb_PWNpkO-gnfvmw9z2SOqF24PtgzJupJ8hnpr3Z2ikh4bLzDUkzs9QsU6O5ZrvjpmeQtCHOutO56qxy146GSAFGSiQovJoVPplf9miKkY41v1DUrm5RV1c1o1TO3vQacqeIywwZgGmgrUOkOFK1iUCaf2EY4DizkLO6ShBQ6o.-skr5G4J-CnsC8CYDXyMU58Y21XESwMPnoAem6ND5NA&dib_tag=se&keywords=minimalist+wall+art+set&qid=1772067932&sr=8-1-spons&aref=WRMh2FVXbJ&sp_csd=d2lkZ2V0TmFtZT1zcF9hdGY&psc=1","Minimalist Bedroom Makeover: Simple Tips For A Serene Space","Create A Calm And Clutter-Free Sanctuary","Learn how to achieve a minimalist bedroom that promotes peace and tranquility. These easy decor ideas focus on clean lines, neutral colors, and functional pieces that maximize your space while creating a serene environment for better sleep. [LIEN_AFFILIATE]","bedroom decor","minimalist decor, bedroom makeover, serene bedroom, calm space, neutral decor, simple living, organization tips, peaceful bedroom","","","","","","",""
"https://www.amazon.fr/s?k=peel+and+stick+wallpaper","https://www.amazon.fr/Arthome-Autocollant-D%C3%A9coratif-Comptoir-rev%C3%AAtement/dp/B09J8GZYT4/ref=sr_1_4_sspa?dib=eyJ2IjoiMSJ9.DQDv_JRJ2DF8B9rfFp2E_PSF00rpS6lPGew9KpljHLkE98ehlUGNlXxi6MiMma8knL4kkXjksTz_b-6pLmp6MfZvgPsHProk3EfrjNfH_UxS41fD6YIA6mRLGr0HwaTo25iFSBMR3Db69gGai54NHjD4CnQU4H81R05xzSxHFCJsilv8aCBoxtdxMd8LoGuv_ok4eodZ04ryImGE-M299jr2LpXJ3uEe_sGlEAU8Rcj8vXC_y2wKfB6k5SLBM3t7rcPtMntg3xLaBHROgY73LSj0iI2MH9VYdEMRvv_EQEg.STo4fvDKdQeZbo9FBc_47UG_f0A7OBIxTQyVNaIkKUI&dib_tag=se&keywords=peel+and+stick+wallpaper&qid=1772067945&sr=8-4-spons&aref=sjSIA1NJfs&sp_csd=d2lkZ2V0TmFtZT1zcF9hdGY&psc=1","Budget-Friendly Bedroom Updates That Look Expensive","Luxury Look For Less - Amazing DIY Ideas","Transform your bedroom on a budget with these clever decor hacks! Discover affordable alternatives to high-end designs using DIY projects, thrift finds, and strategic styling tips that create a luxurious feel without breaking the bank. [LIEN_AFFILIATE]","bedroom decor","budget decor, DIY bedroom, affordable decor, bedroom updates, home makeover, thrift decor, luxury on budget, cheap bedroom ideas","","","","","","",""
"https://www.amazon.fr/s?k=macrame+wall+hanging+tapestry","https://www.amazon.fr/Heveer-Tenture-Tapisserie-D%C3%A9coration-Appartement/dp/B0DD3NC6X5/ref=sr_1_1_sspa?dib=eyJ2IjoiMSJ9.jftadZOf7Nzq3dfuyRHnXUhUoUEURgaWqnQtOtv9TorK2TtEJ-ErTMItZgRgtLg0Z9p_RcmC7YcxcS30EXtoKvyvxqc_FmKxdybUOzDlonYdVI5wmxHPW9I1Fyi1zZj91_MuQiXRS1C1yjSaPsNaAUz6-gr9462gjm0DJueKkDlYLgdLbNnehD1NitOOJEotWgOws-5hbF3mC9Hc4JYuhoqujwOM-3afAyYO3acYFuy9pngd5a9FCnPoYtorZK7CwiqGlky3dgYbXXCvM2LTPqzsz2z5B2tSr7fsIfjg3yk.tktG4p7DTklumvAsJIovTEDhXXXcC1yiXKepJA-Ivy0&dib_tag=se&keywords=macrame+wall+hanging+tapestry&qid=1772067961&sr=8-1-spons&aref=SoiGFoPTYO&sp_csd=d2lkZ2V0TmFtZT1zcF9hdGY&psc=1","Boho Chic Bedroom: How To Create The Perfect Bohemian Retreat","Boho Dreams - Free-Spirited Bedroom Inspiration","Embrace bohemian style with these gorgeous bedroom decor ideas. Learn how to mix textures, patterns, and natural elements to create a relaxed, free-spirited space that feels both cozy and stylish. Perfect for adding personality to your sanctuary! [LIEN_AFFILIATE]","bedroom decor","boho decor, bohemian bedroom, eclectic style, macrame, layered textiles, plant decor, relaxed vibe, personality decor","","","","","","",""
"https://www.amazon.fr/s?k=under+bed+storage+organizers","https://www.amazon.fr/homyfort-Rangement-Organizer-v%C3%AAtements-DEXAUBBP2/dp/B07Y4FJLBY/ref=sr_1_2_sspa?dib=eyJ2IjoiMSJ9.7QGSCdzPZM7l3nSJsF-tsu1rLwfwrEbjOE9xn7USiwnfWxpopUe7WPMJ9uFfUrN-oLleEFLOsu_jiTF0JtSllYpAuS-kn4IC5t5mDjkzxKfnVti6-o0sPbZRLC2x0mtIc8zdfUlnC8CRegTtjT8ucWGyWNMlaVn7WVwTrtkcSjcTfYvTqVQA7255UyK1mwv9HSw_ofabQG441XpTDcvIjdGfZ1dd4HYQ6f10WYY-SX_1apfsv_vfdF8yDTj-H-OihhflYVaJ_MZ6zQhwIFOWs6ypf-dHk5pCpBOJyG0mS68.cZfp7LifOOWd3-KUMC6RnJp20hpRDg3XY3zZ3O9AFJM&dib_tag=se&keywords=under+bed+storage+organizer&qid=1772067976&sr=8-2-spons&aref=IqyasppZJ6&sp_csd=d2lkZ2V0TmFtZT1zcF9hdGY&psc=1","Small Bedroom Solutions: Maximize Space With Smart Decor Tricks","Small Space? Big Style - Genius Storage Ideas","Unlock the potential of your small bedroom with these space-saving decor solutions. From multifunctional furniture to clever storage hacks and optical illusion tricks, these ideas will help you create a stylish and functional retreat. [LIEN_AFFILIATE]","bedroom decor","small bedroom, space saving, bedroom organization, multifunctional furniture, storage solutions, compact living, small space decor, bedroom hacks","","","","","","",""
