"search_link_amazon","amazon_product_url","title","overlay_text","description","niche","french_hint","image_description_for_llm"
"https://www.amazon.fr/s?k=over+sink+foldable+cutting+board+shelf","","Double Your Counter Space With This Genius Folding Shelf","Space On Demand","This brilliant over-the-sink shelf creates instant prep space in tiny kitchens. Folds flat when you need it gone.
👇 Shop this space-saver → [LIEN_AFFILIATE]
#smallkitchen #apartmentliving #kitchenhacks #space-saving #organization","small_space_solutions","Étagère pliante évier","Photorealistic vertical Pinterest image 1000x1500, a bright, airy small kitchen with white shaker cabinets and a stainless steel sink. A beautiful light wood folding shelf is installed over the sink, holding a ceramic bowl of lemons and a small potted herb. Soft morning light streams through a window, illuminating the clean, organized, and highly functional space. 8K photorealistic, professional interior photography style."
"https://www.amazon.fr/s?k=3+tier+metal+utility+rolling+cart","","The Rolling Cart That Solves Every Storage Problem","Storage That Moves","From bathroom to balcony, this sleek cart goes wherever you need extra storage. The ultimate small-space MVP.
🛒 Grab yours here → [LIEN_AFFILIATE]
#smallspace #organizationhacks #apartmentdecor #storagecart #homeorganization","small_space_solutions","Chariot roulant 3 étages","Photorealistic vertical Pinterest image 1000x1500, a stylish bathroom with sage green walls and warm brass fixtures. A sleek black 3-tier rolling cart is tucked neatly beside the vanity, holding neatly rolled towels, bath products in glass jars, and a small plant. The scene is bright, clean, and aspirational, with soft natural light creating a serene atmosphere. 8K photorealistic, professional interior photography style."
"https://www.amazon.fr/s?k=wall+mounted+fold+down+desk+office","","Wall-Mounted Desks That Disappear When You're Done","Office? Gone.","Create a full-sized workspace in seconds, then fold it all away. Perfect for studios and one-bedroom apartments.
✨ Find it on Amazon → [LIEN_AFFILIATE]
#wfhsetup #smallspaceliving #murphy desk #homeofficeideas #apartmentoffice","small_space_solutions","Bureau mural pliant","Photorealistic vertical Pinterest image 1000x1500, a bright living area in a modern apartment. A beautiful light oak wall-mounted desk is folded down against a white wall, creating a clean and minimalist workspace with a laptop and a ceramic mug. The scene is bathed in soft golden-hour light, emphasizing the clever use of vertical space and the uncluttered, peaceful ambiance. 8K photorealistic, professional interior photography style."
"https://www.amazon.fr/s?k=velvet+non+slip+slim+line+hangers","","Slim Hangers That Finally Fit Your Closet","Closet Magic","Instantly double your closet rod space with these ultra-slim, non-slip hangers. Your wardrobe has never looked so good.
💡 Link in profile! [LIEN_AFFILIATE]
#closetorganization #smallcloset #apartmentorganization #wardrobehacks #organizedhome","small_space_solutions","Cintres velours fins","Photorealistic vertical Pinterest image 1000x1500, a close-up, aspirational shot of a neatly organized closet. Dozens of black velvet slimline hangers hold a curated wardrobe of neutral-toned clothing, all perfectly aligned. The space is bright and airy, with soft light highlighting the texture of the fabrics and the clean, luxurious order. 8K photorealistic, professional interior photography style."
"https://www.amazon.fr/s?k=clear+pocket+over+door+shoe+organizer","","The Over-The-Door Organizer That Holds Everything","No Space Wasted","Turn the back of any door into a massive storage hub for shoes, accessories, cleaning supplies, and more.
👇 Shop the look → [LIEN_AFFILIARE]
#doorgganizer #smallspace solutions #apartmentlife #organizationhacks #cleverstorage","small_space_solutions","Organisateur porte chaussures","Photorealistic vertical Pinterest image 1000x1500, an entryway door with a clear over-the-door pocket organizer holding pairs of stylish sneakers and casual shoes in each compartment. The hallway is bright and welcoming with a light oak floor and a neutral runner rug. The organization is perfect and visually satisfying, making the most of unused space. 8K photorealistic, professional interior photography style."
"https://www.amazon.fr/s?k=modern+acrylic+nesting+side+tables","","Nesting Tables That Give You Flexibility & Style","Tables Times Three","One moment they're a single side table, the next they're three surfaces for entertaining. The definition of versatile.
🛒 Grab yours here → [LIEN_AFFILIATE]
#nestingtables #livingroomdecor #smallspacedecor #multifunctional #moderndecor","small_space_solutions","Tables gigognes acrylique","Photorealistic vertical Pinterest image 1000x1500, a cozy living room corner with a large window and a linen sofa. A set of three clear acrylic nesting tables are artfully arranged—one as a primary side table with a book and a vase, the other two tucked neatly underneath. Morning light creates soft reflections on the acrylic, giving a sense of airiness and modern elegance. 8K photorealistic, professional interior photography style."
"https://www.amazon.fr/s?k=fabric+under+bed+storage+bags+with+wheels","","Under-Bed Storage That's Actually Beautiful","Hidden Treasure","Tuck away off-season clothes and linens in these sleek, wheeled bags. Your bedroom will feel instantly bigger and calmer.
✨ Find it on Amazon → [LIEN_AFFILIATE]
#bedroomorganization #underbedstorage #smallbedroom #organizedhome #declutter","small_space_solutions","Range-lit roulettes tissu","Photorealistic vertical Pinterest image 1000x1500, a serene bedroom with a minimalist platform bed. A neutral-toned fabric storage bag on wheels is partially visible underneath, suggesting ample hidden storage without any visual clutter. The room is filled with soft, warm morning light, linen bedding, and a feeling of peaceful order. 8K photorealistic, professional interior photography style."
"https://www.amazon.fr/s?k=kitchen+pot+pan+lid+drawer+organizer","","The Pot Lid Organizer That Fits In Any Drawer","Drawer Goals","No more clattering lids! This simple organizer creates a designated spot for every lid, turning chaos into calm.
💡 Link in profile! [LIEN_AFFILIATE]
#kitchenorganization #drawerorganizer #smallkitchen #cookwarestorage #kitchenhacks","small_space_solutions","Organisateur couvercles tiroir","Photorealistic vertical Pinterest image 1000x1500, a top-down, highly satisfying shot of an organized kitchen drawer. A white plastic lid organizer holds various-sized pot and pan lids upright and neatly separated. The drawer is lined with a light wood contact paper, and the overall effect is one of impeccable order and efficiency. Bright, natural light illuminates the scene. 8K photorealistic, professional interior photography style."
"https://www.amazon.fr/s?k=magnetic+spice+tins+wall+mount+rack","","Magnetic Spice Racks For Tiny Kitchen Walls","Spice Wall Hack","Free up precious cabinet space by turning your empty wall into a stunning (and functional) spice display.
👇 Shop this space-saver → [LIEN_AFFILIARE]
#kitchendesign #smallkitchenideas #spiceorganization #kitchenrenovation #apartmentkitchen","small_space_solutions","Rangement épices magnétique","Photorealistic vertical Pinterest image 1000x1500, a stylish kitchen with white subway tile and dark cabinetry. A magnetic strip is mounted on the wall, holding uniform stainless steel spice tins with clean, minimalist labels. The setup is within easy reach of the stove, showcasing a brilliant use of vertical space. The image is bright, clean, and highly aspirational. 8K photorealistic, professional interior photography style."
"https://www.amazon.fr/s?k=adjustable+drawer+dividers+kitchen+organizer","","Expandable Drawer Dividers For Perfect Order","Custom Fit Order","Make every inch of your drawers work harder. These dividers adjust to fit any space, from cutlery to crafting supplies.
🛒 Grab yours here → [LIEN_AFFILIATE]
#drawerorganization #kitchenorganizer #homeorganization #declutter #smallspace","small_space_solutions","Séparateurs tiroir ajustables","Photorealistic vertical Pinterest image 1000x1500, a perfectly organized kitchen drawer with white adjustable dividers creating custom compartments for utensils, measuring spoons, and kitchen tools. Everything is neatly arranged and easily accessible. The drawer is made of light wood, and the scene is illuminated by bright, clean natural light, emphasizing the satisfying order. 8K photorealistic, professional interior photography style."
"https://www.amazon.fr/s?k=braided+fabric+cable+sleeves+organizer","","Say Goodbye to Cord Chaos Forever","Cable Tangle Solved","Transform that ugly nest of wires into a clean, stylish setup with these braided sleeves. Your desk will never look messy again.
✨ Shop this sleek solution → [LIEN_AFFILIATE]
#cablemanagement #deskorganization #homeoffice #cordorganizer #techaccessories","cable_management","Gaines pour câbles tissées","Photorealistic vertical Pinterest image 1000x1500, a minimalist home office desk setup with a laptop, warm morning light streaming through a large window. A bundle of device cables is neatly wrapped in a beige braided fabric sleeve, lying gracefully on a light oak desk next to a ceramic mug and a small potted plant. The scene is clean, organized, and aspirational with a soft focus background."
"https://www.amazon.fr/s?k=wooden+electronics+charging+station+organizer+box","","The Charging Station That Hides All The Wires","Hidden Charging Hub","Keep phones, tablets, and watches powered up and out of sight. This beautiful wooden box eliminates countertop clutter instantly.
🛒 Get organized here → [LIEN_AFFILIATE]
#cablemanagement #kitchenorganization #chargingstation #homeorganization #techgadgets","cable_management","Station de charge en bois","Photorealistic vertical Pinterest image 1000x1500, a stylish kitchen countertop or entryway console in soft golden-hour light. A light oak wooden charging station box sits elegantly, with its lid slightly ajar to show cables neatly feeding inside. The surrounding decor is minimalist: a vase with a single stem, a framed photo, and warm white walls. The image evokes a sense of calm and order."
"https://www.amazon.fr/s?k=magnetic+tool+holder+strip+workshop","","Stick This Strip & Declutter Your Workshop Wall","Tools In Sight","Finally, a place for every tool. This powerful magnetic strip keeps everything organized and within reach, freeing up your workbench.
👇 Grab this hack → [LIEN_AFFILIATE]
#workshoporganization #diyorganization #toolstorage #garageorganization #cablemanagement","cable_management","Barre magnétique pour outils","Photorealistic vertical Pinterest image 1000x1500, a close-up detail of a clean, organized workshop wall. A sleek, metallic magnetic strip is mounted on a light wood panel. Various tools like pliers, screwdrivers, and wire cutters are neatly held in place against it. Soft, natural light from a nearby window highlights the texture of the tools and wood, creating a satisfying and efficient look."
"https://www.amazon.fr/s?k=adhesive+cable+clips+wire+management","","The Adhesive Clips That Route Cables Like Magic","Wire Routing Made Easy","Guide cords neatly along desks, walls, and furniture without any drilling. These tiny clips make a huge visual difference.
💡 Get them now → [LIEN_AFFILIATE]
#cablemanagement #desksetup #homehacks #cordcontrol #organization","cable_management","Colliers adhésifs pour câbles","Photorealistic vertical Pinterest image 1000x1500, a macro shot of the back corner of a sleek, white desk. Small, clear adhesive cable clips are discreetly holding a single white charging cable in a perfect, straight line along the desk's edge. The background is a soft blur of a tidy room with warm, natural lighting, emphasizing the clean lines and simple solution."
"https://www.amazon.fr/s?k=TV+power+cord+hiding+cover+box","","Your TV Setup Doesn't Have to Be an Eyesore","TV Mess Vanished","Conceal those dangling power cords and messy media boxes in seconds. Achieve that clean, built-in look you see in magazines.
✨ Shop the solution → [LIEN_AFFILIATE]
#cablemanagement #tvsetup #livingroomdecor #homeorganization #mediacenter","cable_management","Cache-câbles pour TV","Photorealistic vertical Pinterest image 1000x1500, a beautifully styled living room media center. A modern TV is mounted on a light wall. At its base, a white cable management box sits on a console, perfectly hiding all power strips and cord tangles. The scene is lit by gentle afternoon sun, with a minimalist decor style featuring a wooden console, a green plant, and a few coffee table books."
"https://www.amazon.fr/s?k=rolling+under+desk+cable+management+tray","","The Roll-Away Organizer For All Your Cables","Under Desk Order","Tame the jungle of wires under your desk with this sliding tray. It keeps power strips and cables off the floor and out of sight.
🛒 Organize your space → [LIEN_AFFILIATE]
#cablemanagement #homeoffice #deskorganization #wfhsetup #officeessentials","cable_management","Range-câbles roulant","Photorealistic vertical Pinterest image 1000x1500, a low-angle shot looking under a modern, light wood standing desk. A sleek, mesh metal cable management tray is mounted underneath, holding a power strip with all cables coiled and tied neatly. The floor is a clean, polished concrete, and soft light creates a sense of spaciousness and impeccable order."
"https://www.amazon.fr/s?k=headphone+stand+with+cable+management","","Never Untangle Your Headphones Again","Tangle-Free Audio","This elegant stand keeps your headphones ready to go and your desk looking pristine. A simple upgrade for a more organized life.
💡 Grab this stand → [LIEN_AFFILIATE]
#cablemanagement #deskaccessories #headphonestand #gamingsetup #workspace","cable_management","Support pour casque","Photorealistic vertical Pinterest image 1000x1500, a serene desk setup with morning light. A premium pair of black headphones rests on a sleek, modern headphone stand made of brushed aluminum and walnut wood. The headphone cable is wrapped neatly around a built-in management post on the stand's base. The scene includes a keyboard and a notebook, all on a light oak desk surface."
"https://www.amazon.fr/s?k=power+strip+cover+box+fabric","","The Simple Sleeve That Upgrades Any Power Strip","Power Strip Hidden","Turn your bulky, ugly power strip into a decorative box. It's the easiest way to add style and safety to any room.
👇 Hide yours now → [LIEN_AFFILIATE]
#cablemanagement #homehacks #diydecor #safetyfirst #organizedhome","cable_management","Boîtier pour multiprise","Photorealistic vertical Pinterest image 1000x1500, a cozy corner of a living room with a comfortable armchair. On the floor next to a plug socket, a stylish beige linen-covered box sits, with several device cables (for a lamp and phone charger) neatly emerging from a single slit. The warm, golden-hour lighting and textured rug make the solution look both smart and inviting."
"https://www.amazon.fr/s?k=desk+cable+holder+clamp+clip","","Keep Cords From Sliding Off Your Desk","No More Falling Cords","This simple clamp secures your charging cables right where you need them. Never fish for a cord behind your desk again.
✨ Get this clip → [LIEN_AFFILIATE]
#cablemanagement #deskorganization #officehacks #productivity #worksfromhome","cable_management","Pince de fixation câble","Photorealistic vertical Pinterest image 1000x1500, an overhead shot of a minimalist desk. A small, clear plastic cable clamp is attached to the back edge of a white desk, firmly holding a white USB-C cable in place. The cable is coiled neatly. The rest of the desk is tidy with a laptop, a notepad, and a pen, all bathed in soft, natural light from a window."
"https://www.amazon.fr/s?k=drawer+cable+organizer+dividers+bins","","Organize Every Cord In Your Drawer","Junk Drawer Solved","Transform your chaotic utility drawer into a perfectly organized space. Find any cable or adapter in seconds, not minutes.
🛒 Organize it → [LIEN_AFFILIATE]
#cablemanagement #drawerorganization #homeorganization #kitchenhacks #organizedlife","cable_management","Organisateur tiroir câbles","Photorealistic vertical Pinterest image 1000x1500, a top-down view into an open drawer with a light wood interior. Clear acrylic organizer bins and dividers create separate compartments for different types of cables (USB, HDMI, power), chargers, and small tech accessories. Each item is neatly coiled and placed. The lighting is bright and clear, making the organization system look incredibly satisfying."
"https://www.amazon.fr/s?k=stackable+clear+pantry+organizer+bins","","Pantry Perfection In One Simple Step","Pantry Goals","Transform chaotic cupboards into a vision of organized bliss. These clear bins make everything easy to find and so aesthetically pleasing.
🛒 Get the look → [LIEN_AFFILIATE]
#pantryorganization #kitchenorganization #organizedhome #pantrygoals #homedecor","kitchen_organization","Bacs de rangement cuisine","Photorealistic vertical Pinterest image 1000x1500, a perfectly organized walk-in pantry with open shelves. Sunlight streams through a large window, illuminating rows of identical clear acrylic bins with uniform white labels. Inside the bins are dry goods like pasta, rice, and oats. The shelves are light wood, and the overall feel is calm, luxurious, and meticulously ordered."
"https://www.amazon.fr/s?k=magnetic+spice+jar+lids+organizer+rack","","The Spice Rack That Actually Fits Everything","Spice Life","Ditch the cluttered drawer and display your spices with style. This magnetic system is a total game-changer for any home chef.
✨ Find it here → [LIEN_AFFILIATE]
#kitchenorganization #spicerack #cookingessentials #kitchendesign #organizedkitchen","kitchen_organization","Range-épices magnétique","Photorealistic vertical Pinterest image 1000x1500, a close-up detail shot of a sleek stainless steel refrigerator side. Two rows of identical glass spice jars with magnetic lids are neatly attached. The labels are clear and uniform. In the soft-focus background is a beautiful, minimalist kitchen with marble countertops and warm morning light."
"https://www.amazon.fr/s?k=kitchen+utensil+drawer+divider+organizer+adjustable","","Drawer Chaos Solved For Good","Drawer Harmony","Finally, a place for every spatula, whisk, and spoon. This custom-fit organizer turns a jumbled mess into a satisfying display of order.
👇 Shop this hack → [LIEN_AFFILIATE]
#kitchenorganization #drawerorganization #kitchenhacks #homeorganization #kitchenremodel","kitchen_organization","Organisateur tiroir couverts","Photorealistic vertical Pinterest image 1000x1500, an overhead shot looking down into a deep kitchen drawer. A sleek, light grey adjustable divider system creates perfect compartments for kitchen tools like wooden spoons, silicone spatulas, and measuring cups. The drawer interior is a warm wood tone, and the lighting is soft and even, highlighting the neat arrangement."
"https://www.amazon.fr/s?k=2+tier+under+sink+organizer+sliding+rack","","Under-Sink Storage That's Actually Beautiful","Hidden & Tidy","Maximize every inch of wasted space. This sliding rack keeps all your cleaning supplies neat, accessible, and out of sight.
💡 Link in profile! [LIEN_AFFILIATE]
#kitchenorganization #undersinkstorage #cleaningorganization #homeorganization #organizinghacks","kitchen_organization","Range-bouteilles éviers","Photorealistic vertical Pinterest image 1000x1500, a cabinet door is open, revealing the pristine space under a kitchen sink. A white, two-tier sliding wire organizer holds matching amber glass spray bottles and neatly aligned cleaning products. The pipes are clean, and the space feels efficient and surprisingly elegant, lit by soft ambient light."
"https://www.amazon.fr/s?k=acrylic+paper+towel+holder+utensil+crock","","Your Countertop Clutter Just Met Its Match","Clean Countertops","Clear acrylic keeps your essentials organized without adding visual weight. The minimalist upgrade your countertop deserves.
🛒 Grab this set → [LIEN_AFFILIATE]
#kitchenorganization #kitchendecor #minimalistkitchen #countertoporganization #acrylichome","kitchen_organization","Porte-essuie-tout acrylique","Photorealistic vertical Pinterest image 1000x1500, a serene kitchen countertop scene during golden hour. A sleek, crystal-clear acrylic paper towel holder and a matching utensil crock sit next to a modern stove. The counter is a light quartz, and the only other items are a beautiful olive oil bottle and a wooden cutting board, creating a sense of spacious calm."
"https://www.amazon.fr/s?k=heavy+duty+cabinet+lazy+susan+turntable+organizer","","The Lazy Susan That Revolutionizes Corner Cabinets","No More Lost Items","Never rummage in the back of a dark cabinet again. Spin and find what you need instantly. It's pure kitchen magic.
✨ Discover more → [LIEN_AFFILIATE]
#kitchenorganization #lazysusan #cabinetorganization #kitchenideas #organizationsolutions","kitchen_organization","Plateau tournant placard","Photorealistic vertical Pinterest image 1000x1500, a corner kitchen cabinet is open, showcasing a large, sturdy white lazy susan turntable. It is neatly stocked with various jars of spices, oils, and vinegar, all easily accessible. The cabinet interior is a clean white, and the image is bright and airy, emphasizing the functionality and neatness."
"https://www.amazon.fr/s?k=pot+lid+organizer+rack+cabinet+shelf","","Stack Your Pots & Lids Without The Frustration","Pot Lid Solved","Tame the most unruly part of your kitchen. This simple rack creates a designated home for every pot and its matching lid.
👇 Shop the solution → [LIEN_AFFILIATE]
#kitchenorganization #potlidorganizer #cabinetorganization #cooking #organizedhome","kitchen_organization","Range-couvercles casseroles","Photorealistic vertical Pinterest image 1000x1500, an interior shot of a deep kitchen cabinet. A sleek metal organizer holds several pot lids upright and neatly separated. In front of it, matching stainless steel pots are stacked. The organization is impeccable, and the lighting shows off the clean lines and metallic finishes."
"https://www.amazon.fr/s?k=can+rack+dispenser+pantry+FIFO+organizer","","The Can Organizer That Saves You Space & Time","Smart Can Storage","First in, first out! This dispenser-style rack automatically organizes your cans and makes pantry inventory a breeze.
💡 Organize it now → [LIEN_AFFILIATE]
#pantryorganization #kitchenorganization #canorganizer #foodstorage #organizing","kitchen_organization","Distributeur boîtes conserve","Photorealistic vertical Pinterest image 1000x1500, a close-up view of a wire can organizer inside a pantry. Cans of tomatoes and beans are neatly lined up in the dispenser, with one can rolling forward to the front. The surrounding shelves are organized with other clear bins, and the overall feeling is one of efficient, smart design in a warm, well-lit space."
"https://www.amazon.fr/s?k=clear+refrigerator+bins+organization+set","","Give Your Frigerator A Makeover In Minutes","Fridge Feng Shui","Turn your fridge from a chaotic mess into a masterpiece of organization. Find anything at a glance with clear, stackable bins.
🛒 Transform your fridge → [LIEN_AFFILIATE]
#refrigeratororganization #kitchenorganization #fridgegoals #homeorganization #clearlifestyle","kitchen_organization","Bacs rangement frigo","Photorealistic vertical Pinterest image 1000x1500, the door of a sleek stainless steel refrigerator is open, revealing a perfectly organized interior. Clear, stackable bins contain categories of food: yogurts, cheeses, beverages. Everything is visible and orderly. The fridge is fully stocked but looks clean and spacious, lit by its internal light."
"https://www.amazon.fr/s?k=automatic+motion+sensor+stainless+kitchen+trash+can","","The Trash Can That Hides It All Beautifully","Discreet & Clean","Upgrade your kitchen with a touch-free, odor-blocking bin that looks more like a sleek appliance. Goodbye, eyesore!
✨ See it on Amazon → [LIEN_AFFILIATE]
#kitchenorganization #kitchendesign #trashcan #smartkitchen #modernhome","kitchen_organization","Poubelle cuisine automatique","Photorealistic vertical Pinterest image 1000x1500, a beautiful kitchen corner with soft morning light. A tall, brushed stainless steel automatic trash can sits discreetly next to a cabinet. The lid is closed, and it blends seamlessly with the high-end appliances. The surrounding area is clean and minimalist, with a hint of a beautiful tile backsplash in the background."
